titulo,descripcion,instrumento,derecho,ods,fuente,fuente_url
Consultorios de especialidad en Miguel Hidalgo,"Consultorios médicos públicos, sociales o privados que tienen como fin prestar atención médica especializada a través de personal médico que cuenta con alguna especialidad.",Visor Alcaldías,Derecho a la salud,Salud y bienestar,"SALUD, DGIS",https://www.gob.mx/salud/acciones-y-programas/direccion-general-de-informacion-en-salud-dgis
Consultorios de especialidad en Cuauhtémoc,"Consultorios médicos públicos, sociales o privados que tienen como fin prestar atención médica especializada a través de personal médico que cuenta con alguna especialidad.",Visor Alcaldías,Derecho a la salud,Salud y bienestar,"SALUD, DGIS",https://www.gob.mx/salud/acciones-y-programas/direccion-general-de-informacion-en-salud-dgis
Consultorios de especialidad en Benito Juárez,"Consultorios médicos públicos, sociales o privados que tienen como fin prestar atención médica especializada a través de personal médico que cuenta con alguna especialidad.",Visor Alcaldías,Derecho a la salud,Salud y bienestar,"SALUD, DGIS",https://www.gob.mx/salud/acciones-y-programas/direccion-general-de-informacion-en-salud-dgis
Consultorios de especialidad en Xochimilco,"Consultorios médicos públicos, sociales o privados que tienen como fin prestar atención médica especializada a través de personal médico que cuenta con alguna especialidad.",Visor Alcaldías,Derecho a la salud,Salud y bienestar,"SALUD, DGIS",https://www.gob.mx/salud/acciones-y-programas/direccion-general-de-informacion-en-salud-dgis
Consultorios de especialidad en Tlalpan,"Consultorios médicos públicos, sociales o privados que tienen como fin prestar atención médica especializada a través de personal médico que cuenta con alguna especialidad.",Visor Alcaldías,Derecho a la salud,Salud y bienestar,"SALUD, DGIS",https://www.gob.mx/salud/acciones-y-programas/direccion-general-de-informacion-en-salud-dgis
Consultorios de especialidad en Tláhuac,"Consultorios médicos públicos, sociales o privados que tienen como fin prestar atención médica especializada a través de personal médico que cuenta con alguna especialidad.",Visor Alcaldías,Derecho a la salud,Salud y bienestar,"SALUD, DGIS",https://www.gob.mx/salud/acciones-y-programas/direccion-general-de-informacion-en-salud-dgis
Consultorios de especialidad en Álvaro Obregón,"Consultorios médicos públicos, sociales o privados que tienen como fin prestar atención médica especializada a través de personal médico que cuenta con alguna especialidad.",Visor Alcaldías,Derecho a la salud,Salud y bienestar,"SALUD, DGIS",https://www.gob.mx/salud/acciones-y-programas/direccion-general-de-informacion-en-salud-dgis
Consultorios de especialidad en Milpa Alta,"Consultorios médicos públicos, sociales o privados que tienen como fin prestar atención médica especializada a través de personal médico que cuenta con alguna especialidad.",Visor Alcaldías,Derecho a la salud,Salud y bienestar,"SALUD, DGIS",https://www.gob.mx/salud/acciones-y-programas/direccion-general-de-informacion-en-salud-dgis
Consultorios de especialidad en Magdalena Contreras,"Consultorios médicos públicos, sociales o privados que tienen como fin prestar atención médica especializada a través de personal médico que cuenta con alguna especialidad.",Visor Alcaldías,Derecho a la salud,Salud y bienestar,"SALUD, DGIS",https://www.gob.mx/salud/acciones-y-programas/direccion-general-de-informacion-en-salud-dgis
Consultorios de especialidad en Iztapalapa,"Consultorios médicos públicos, sociales o privados que tienen como fin prestar atención médica especializada a través de personal médico que cuenta con alguna especialidad.",Visor Alcaldías,Derecho a la salud,Salud y bienestar,"SALUD, DGIS",https://www.gob.mx/salud/acciones-y-programas/direccion-general-de-informacion-en-salud-dgis
Consultorios de especialidad en Iztacalco,"Consultorios médicos públicos, sociales o privados que tienen como fin prestar atención médica especializada a través de personal médico que cuenta con alguna especialidad.",Visor Alcaldías,Derecho a la salud,Salud y bienestar,"SALUD, DGIS",https://www.gob.mx/salud/acciones-y-programas/direccion-general-de-informacion-en-salud-dgis
Consultorios de especialidad en Gustavo A. Madero,"Consultorios médicos públicos, sociales o privados que tienen como fin prestar atención médica especializada a través de personal médico que cuenta con alguna especialidad.",Visor Alcaldías,Derecho a la salud,Salud y bienestar,"SALUD, DGIS",https://www.gob.mx/salud/acciones-y-programas/direccion-general-de-informacion-en-salud-dgis
Consultorios de especialidad en Cuajimalpa,"Consultorios médicos públicos, sociales o privados que tienen como fin prestar atención médica especializada a través de personal médico que cuenta con alguna especialidad.",Visor Alcaldías,Derecho a la salud,Salud y bienestar,"SALUD, DGIS",https://www.gob.mx/salud/acciones-y-programas/direccion-general-de-informacion-en-salud-dgis
Consultorios de especialidad en Coyoacán,"Consultorios médicos públicos, sociales o privados que tienen como fin prestar atención médica especializada a través de personal médico que cuenta con alguna especialidad.",Visor Alcaldías,Derecho a la salud,Salud y bienestar,"SALUD, DGIS",https://www.gob.mx/salud/acciones-y-programas/direccion-general-de-informacion-en-salud-dgis
Consultorios de especialidad en Azcapotzalco,"Consultorios médicos públicos, sociales o privados que tienen como fin prestar atención médica especializada a través de personal médico que cuenta con alguna especialidad.",Visor Alcaldías,Derecho a la salud,Salud y bienestar,"SALUD, DGIS",https://www.gob.mx/salud/acciones-y-programas/direccion-general-de-informacion-en-salud-dgis
Consultorios en Venustiano Carranza,"Consultorios médicos públicos, sociales o privados.",Visor Alcaldías,Derecho a la salud,Salud y bienestar,"SALUD, DGIS",https://www.gob.mx/salud/acciones-y-programas/direccion-general-de-informacion-en-salud-dgis
Consultorios en Miguel Hidalgo,"Consultorios médicos públicos, sociales o privados.",Visor Alcaldías,Derecho a la salud,Salud y bienestar,"SALUD, DGIS",https://www.gob.mx/salud/acciones-y-programas/direccion-general-de-informacion-en-salud-dgis
Consultorios en Cuauhtémoc,"Consultorios médicos públicos, sociales o privados.",Visor Alcaldías,Derecho a la salud,Salud y bienestar,"SALUD, DGIS",https://www.gob.mx/salud/acciones-y-programas/direccion-general-de-informacion-en-salud-dgis
Consultorios en Benito Juárez,"Consultorios médicos públicos, sociales o privados.",Visor Alcaldías,Derecho a la salud,Salud y bienestar,"SALUD, DGIS",https://www.gob.mx/salud/acciones-y-programas/direccion-general-de-informacion-en-salud-dgis
Consultorios en Xochimilco,"Consultorios médicos públicos, sociales o privados.",Visor Alcaldías,Derecho a la salud,Salud y bienestar,"SALUD, DGIS",https://www.gob.mx/salud/acciones-y-programas/direccion-general-de-informacion-en-salud-dgis
Consultorios en Tlalpan,"Consultorios médicos públicos, sociales o privados.",Visor Alcaldías,Derecho a la salud,Salud y bienestar,"SALUD, DGIS",https://www.gob.mx/salud/acciones-y-programas/direccion-general-de-informacion-en-salud-dgis
Consultorios en Tláhuac,"Consultorios médicos públicos, sociales o privados.",Visor Alcaldías,Derecho a la salud,Salud y bienestar,"SALUD, DGIS",https://www.gob.mx/salud/acciones-y-programas/direccion-general-de-informacion-en-salud-dgis
Consultorios en Álvaro Obregón,"Consultorios médicos públicos, sociales o privados.",Visor Alcaldías,Derecho a la salud,Salud y bienestar,"SALUD, DGIS",https://www.gob.mx/salud/acciones-y-programas/direccion-general-de-informacion-en-salud-dgis
Consultorios en Milpa Alta,"Consultorios médicos públicos, sociales o privados.",Visor Alcaldías,Derecho a la salud,Salud y bienestar,"SALUD, DGIS",https://www.gob.mx/salud/acciones-y-programas/direccion-general-de-informacion-en-salud-dgis
Consultorios en Magdalena Contreras,"Consultorios médicos públicos, sociales o privados.",Visor Alcaldías,Derecho a la salud,Salud y bienestar,"SALUD, DGIS",https://www.gob.mx/salud/acciones-y-programas/direccion-general-de-informacion-en-salud-dgis
Consultorios en Iztapalapa,"Consultorios médicos públicos, sociales o privados.",Visor Alcaldías,Derecho a la salud,Salud y bienestar,"SALUD, DGIS",https://www.gob.mx/salud/acciones-y-programas/direccion-general-de-informacion-en-salud-dgis
Consultorios en Iztacalco,"Consultorios médicos públicos, sociales o privados.",Visor Alcaldías,Derecho a la salud,Salud y bienestar,"SALUD, DGIS",https://www.gob.mx/salud/acciones-y-programas/direccion-general-de-informacion-en-salud-dgis
Consultorios en Gustavo A. Madero,"Consultorios médicos públicos, sociales o privados.",Visor Alcaldías,Derecho a la salud,Salud y bienestar,"SALUD, DGIS",https://www.gob.mx/salud/acciones-y-programas/direccion-general-de-informacion-en-salud-dgis
Consultorios en Cuajimalpa,"Consultorios médicos públicos, sociales o privados.",Visor Alcaldías,Derecho a la salud,Salud y bienestar,"SALUD, DGIS",https://www.gob.mx/salud/acciones-y-programas/direccion-general-de-informacion-en-salud-dgis
Consultorios en Coyoacán,"Consultorios médicos públicos, sociales o privados.",Visor Alcaldías,Derecho a la salud,Salud y bienestar,"SALUD, DGIS",https://www.gob.mx/salud/acciones-y-programas/direccion-general-de-informacion-en-salud-dgis
Consultorios en Azcapotzalco,"Consultorios médicos públicos, sociales o privados.",Visor Alcaldías,Derecho a la salud,Salud y bienestar,"SALUD, DGIS",https://www.gob.mx/salud/acciones-y-programas/direccion-general-de-informacion-en-salud-dgis
Establecimientos de salud en Venustiano Carranza,"Establecimientos en operación de los sectores público, social y privado en el que se presta atención médica integral a la población; cuenta con recursos materiales, humanos, tecnológicos y económicos, cuya complejidad va en proporción directa al nivel de operación.",Visor Alcaldías,Derecho a la salud,Salud y bienestar,"SALUD, DGIS",https://www.gob.mx/salud/acciones-y-programas/direccion-general-de-informacion-en-salud-dgis
Establecimientos de salud en Benito Juárez,"Establecimientos en operación de los sectores público, social y privado en el que se presta atención médica integral a la población; cuenta con recursos materiales, humanos, tecnológicos y económicos, cuya complejidad va en proporción directa al nivel de operación.",Visor Alcaldías,Derecho a la salud,Salud y bienestar,"SALUD, DGIS",https://www.gob.mx/salud/acciones-y-programas/direccion-general-de-informacion-en-salud-dgis
Establecimientos de salud en Gustavo A. Madero,"Establecimientos en operación de los sectores público, social y privado en el que se presta atención médica integral a la población; cuenta con recursos materiales, humanos, tecnológicos y económicos, cuya complejidad va en proporción directa al nivel de operación.",Visor Alcaldías,Derecho a la salud,Salud y bienestar,"SALUD, DGIS",https://www.gob.mx/salud/acciones-y-programas/direccion-general-de-informacion-en-salud-dgis
Establecimientos de salud en Magdalena Contreras,"Establecimientos en operación de los sectores público, social y privado en el que se presta atención médica integral a la población; cuenta con recursos materiales, humanos, tecnológicos y económicos, cuya complejidad va en proporción directa al nivel de operación.",Visor Alcaldías,Derecho a la salud,Salud y bienestar,"SALUD, DGIS",https://www.gob.mx/salud/acciones-y-programas/direccion-general-de-informacion-en-salud-dgis
Establecimientos de salud en Álvaro Obregón,"Establecimientos en operación de los sectores público, social y privado en el que se presta atención médica integral a la población; cuenta con recursos materiales, humanos, tecnológicos y económicos, cuya complejidad va en proporción directa al nivel de operación.",Visor Alcaldías,Derecho a la salud,Salud y bienestar,"SALUD, DGIS",https://www.gob.mx/salud/acciones-y-programas/direccion-general-de-informacion-en-salud-dgis
Establecimientos de salud en Miguel Hidalgo,"Establecimientos en operación de los sectores público, social y privado en el que se presta atención médica integral a la población; cuenta con recursos materiales, humanos, tecnológicos y económicos, cuya complejidad va en proporción directa al nivel de operación.",Visor Alcaldías,Derecho a la salud,Salud y bienestar,"SALUD, DGIS",https://www.gob.mx/salud/acciones-y-programas/direccion-general-de-informacion-en-salud-dgis
Establecimientos de salud en Milpa Alta,"Establecimientos en operación de los sectores público, social y privado en el que se presta atención médica integral a la población; cuenta con recursos materiales, humanos, tecnológicos y económicos, cuya complejidad va en proporción directa al nivel de operación.",Visor Alcaldías,Derecho a la salud,Salud y bienestar,"SALUD, DGIS",https://www.gob.mx/salud/acciones-y-programas/direccion-general-de-informacion-en-salud-dgis
Establecimientos de salud en Azcapotzalco,"Establecimientos en operación de los sectores público, social y privado en el que se presta atención médica integral a la población; cuenta con recursos materiales, humanos, tecnológicos y económicos, cuya complejidad va en proporción directa al nivel de operación.",Visor Alcaldías,Derecho a la salud,Salud y bienestar,"SALUD, DGIS",https://www.gob.mx/salud/acciones-y-programas/direccion-general-de-informacion-en-salud-dgis
Establecimientos de salud en Iztacalco,"Establecimientos en operación de los sectores público, social y privado en el que se presta atención médica integral a la población; cuenta con recursos materiales, humanos, tecnológicos y económicos, cuya complejidad va en proporción directa al nivel de operación.",Visor Alcaldías,Derecho a la salud,Salud y bienestar,"SALUD, DGIS",https://www.gob.mx/salud/acciones-y-programas/direccion-general-de-informacion-en-salud-dgis
Establecimientos de salud en Coyoacán,"Establecimientos en operación de los sectores público, social y privado en el que se presta atención médica integral a la población; cuenta con recursos materiales, humanos, tecnológicos y económicos, cuya complejidad va en proporción directa al nivel de operación.",Visor Alcaldías,Derecho a la salud,Salud y bienestar,"SALUD, DGIS",https://www.gob.mx/salud/acciones-y-programas/direccion-general-de-informacion-en-salud-dgis
Establecimientos de salud en Cuauhtémoc,"Establecimientos en operación de los sectores público, social y privado en el que se presta atención médica integral a la población; cuenta con recursos materiales, humanos, tecnológicos y económicos, cuya complejidad va en proporción directa al nivel de operación.",Visor Alcaldías,Derecho a la salud,Salud y bienestar,"SALUD, DGIS",https://www.gob.mx/salud/acciones-y-programas/direccion-general-de-informacion-en-salud-dgis
Establecimientos de salud en Tláhuac,"Establecimientos en operación de los sectores público, social y privado en el que se presta atención médica integral a la población; cuenta con recursos materiales, humanos, tecnológicos y económicos, cuya complejidad va en proporción directa al nivel de operación.",Visor Alcaldías,Derecho a la salud,Salud y bienestar,"SALUD, DGIS",https://www.gob.mx/salud/acciones-y-programas/direccion-general-de-informacion-en-salud-dgis
Establecimientos de salud en Tlalpan,"Establecimientos en operación de los sectores público, social y privado en el que se presta atención médica integral a la población; cuenta con recursos materiales, humanos, tecnológicos y económicos, cuya complejidad va en proporción directa al nivel de operación.",Visor Alcaldías,Derecho a la salud,Salud y bienestar,"SALUD, DGIS",https://www.gob.mx/salud/acciones-y-programas/direccion-general-de-informacion-en-salud-dgis
Establecimientos de salud en Iztapalapa,"Establecimientos en operación de los sectores público, social y privado en el que se presta atención médica integral a la población; cuenta con recursos materiales, humanos, tecnológicos y económicos, cuya complejidad va en proporción directa al nivel de operación.",Visor Alcaldías,Derecho a la salud,Salud y bienestar,"SALUD, DGIS",https://www.gob.mx/salud/acciones-y-programas/direccion-general-de-informacion-en-salud-dgis
Establecimientos de salud de Xochimilco,"Establecimientos en operación de los sectores público, social y privado en el que se presta atención médica integral a la población; cuenta con recursos materiales, humanos, tecnológicos y económicos, cuya complejidad va en proporción directa al nivel de operación.",Visor Alcaldías,Derecho a la salud,Salud y bienestar,"SALUD, DGIS",https://www.gob.mx/salud/acciones-y-programas/direccion-general-de-informacion-en-salud-dgis
Establecimientos de salud en Cuajimalpa,"Establecimientos en operación de los sectores público, social y privado en el que se presta atención médica integral a la población; cuenta con recursos materiales, humanos, tecnológicos y económicos, cuya complejidad va en proporción directa al nivel de operación.",Visor Alcaldías,Derecho a la salud,Salud y bienestar,"SALUD, DGIS",https://www.gob.mx/salud/acciones-y-programas/direccion-general-de-informacion-en-salud-dgis
Gasto ejercido en la compra de bienes inmuebles (terrenos) de las entidades de la Ciudad de México,Gasto por concepto de compra de bienes inmuebles (terrenos) en en la Cuenta Pública. Incluye gobierno central y alcaldías.,PGOT,"Derecho a la tierra, al territorio y a los recursos naturales","Paz, justicia e instituciones sólidas",Secretaría de Administración y Finanzas,http://www.finanzas.cdmx.gob.mx/servicios/servicio/proyecto-paquete-economico
Porcentaje de presupuesto asignado a CTI en la Ciudad de México,"Porcentaje de presupuesto asignado a ciencia, tecnología e innovación (CTI) en la Ciudad de México.",PGD,Derecho a la ciencia y a la innovación tecnológica,"Industria, innovación e infraestructura",Informe de cuenta pública SAF,https://www.inegi.org.mx/programas/esidet/2017/#Microdatos
Viviendas en Magdalena Contreras por número de cuartos,La cantidad de cuartos que tienen las viviendas proporciona una aproximación al estudio del tamaño de las viviendas. Este indicador registra el total de viviendas desagregado por número de cuartos.,Derecho a la vivienda,Reducción de las desigualdades,Censo de Población y Vivienda,Censo de Población y Vivienda,https://www.inegi.org.mx/programas/ccpv/2020/
Viviendas en Gustavo A. Madero por número de cuartos,La cantidad de cuartos que tienen las viviendas proporciona una aproximación al estudio del tamaño de las viviendas. Este indicador registra el total de viviendas desagregado por número de cuartos.,Derecho a la vivienda,Reducción de las desigualdades,Censo de Población y Vivienda,Censo de Población y Vivienda,https://www.inegi.org.mx/programas/ccpv/2020/
Viviendas en Álvaro Obregón por número de cuartos,La cantidad de cuartos que tienen las viviendas proporciona una aproximación al estudio del tamaño de las viviendas. Este indicador registra el total de viviendas desagregado por número de cuartos.,Derecho a la vivienda,Reducción de las desigualdades,Censo de Población y Vivienda,Censo de Población y Vivienda,https://www.inegi.org.mx/programas/ccpv/2020/
Viviendas en Cuajimalpa por número de cuartos,La cantidad de cuartos que tienen las viviendas proporciona una aproximación al estudio del tamaño de las viviendas. Este indicador registra el total de viviendas desagregado por número de cuartos.,Derecho a la vivienda,Reducción de las desigualdades,Censo de Población y Vivienda,Censo de Población y Vivienda,https://www.inegi.org.mx/programas/ccpv/2020/
Viviendas en Coyoacán por número de cuartos,La cantidad de cuartos que tienen las viviendas proporciona una aproximación al estudio del tamaño de las viviendas. Este indicador registra el total de viviendas desagregado por número de cuartos.,Derecho a la vivienda,Reducción de las desigualdades,Censo de Población y Vivienda,Censo de Población y Vivienda,https://www.inegi.org.mx/programas/ccpv/2020/
Viviendas en Tláhuac por número de cuartos,La cantidad de cuartos que tienen las viviendas proporciona una aproximación al estudio del tamaño de las viviendas. Este indicador registra el total de viviendas desagregado por número de cuartos.,Derecho a la vivienda,Reducción de las desigualdades,Censo de Población y Vivienda,Censo de Población y Vivienda,https://www.inegi.org.mx/programas/ccpv/2020/
Viviendas en Milpa Alta por número de cuartos,La cantidad de cuartos que tienen las viviendas proporciona una aproximación al estudio del tamaño de las viviendas. Este indicador registra el total de viviendas desagregado por número de cuartos.,Derecho a la vivienda,Reducción de las desigualdades,Censo de Población y Vivienda,Censo de Población y Vivienda,https://www.inegi.org.mx/programas/ccpv/2020/
Viviendas en Iztacalco por número de cuartos,La cantidad de cuartos que tienen las viviendas proporciona una aproximación al estudio del tamaño de las viviendas. Este indicador registra el total de viviendas desagregado por número de cuartos.,Derecho a la vivienda,Reducción de las desigualdades,Censo de Población y Vivienda,Censo de Población y Vivienda,https://www.inegi.org.mx/programas/ccpv/2020/
Viviendas en Azcapotzalco por número de cuartos,La cantidad de cuartos que tienen las viviendas proporciona una aproximación al estudio del tamaño de las viviendas. Este indicador registra el total de viviendas desagregado por número de cuartos.,Reducción de las desigualdades,Censo de Población y Vivienda,Ver recursos,Censo de Población y Vivienda,https://www.inegi.org.mx/programas/ccpv/2020/
Viviendas en Miguel Hidalgo por número de cuartos,La cantidad de cuartos que tienen las viviendas proporciona una aproximación al estudio del tamaño de las viviendas. Este indicador registra el total de viviendas desagregado por número de cuartos.,Derecho a la vivienda,Reducción de las desigualdades,Censo de Población y Vivienda,Censo de Población y Vivienda,https://www.inegi.org.mx/programas/ccpv/2020/
Viviendas en Benito Juárez por número de cuartos,La cantidad de cuartos que tienen las viviendas proporciona una aproximación al estudio del tamaño de las viviendas. Este indicador registra el total de viviendas desagregado por número de cuartos.,Derecho a la vivienda,Reducción de las desigualdades,Censo de Población y Vivienda,Censo de Población y Vivienda,https://www.inegi.org.mx/programas/ccpv/2020/
Viviendas en Iztapalapa por número de cuartos,La cantidad de cuartos que tienen las viviendas proporciona una aproximación al estudio del tamaño de las viviendas. Este indicador registra el total de viviendas desagregado por número de cuartos.,Derecho a la vivienda,Reducción de las desigualdades,Censo de Población y Vivienda,Censo de Población y Vivienda,https://www.inegi.org.mx/programas/ccpv/2020/
Viviendas en Cuauhtémoc por número de cuartos,La cantidad de cuartos que tienen las viviendas proporciona una aproximación al estudio del tamaño de las viviendas. Este indicador registra el total de viviendas desagregado por número de cuartos.,Derecho a la vivienda,Reducción de las desigualdades,Censo de Población y Vivienda,Censo de Población y Vivienda,https://www.inegi.org.mx/programas/ccpv/2020/
Viviendas en Xochimilco por número de cuartos,La cantidad de cuartos que tienen las viviendas proporciona una aproximación al estudio del tamaño de las viviendas. Este indicador registra el total de viviendas desagregado por número de cuartos.,Derecho a la vivienda,Reducción de las desigualdades,Censo de Población y Vivienda,Censo de Población y Vivienda,https://www.inegi.org.mx/programas/ccpv/2020/
Viviendas en Tlalpan por número de cuartos,La cantidad de cuartos que tienen las viviendas proporciona una aproximación al estudio del tamaño de las viviendas. Este indicador registra el total de viviendas desagregado por número de cuartos.,Derecho a la vivienda,Reducción de las desigualdades,Censo de Población y Vivienda,Censo de Población y Vivienda,https://www.inegi.org.mx/programas/ccpv/2020/
Viviendas de Milpa Alta por número de dormitorios,Total de viviendas según el número de cuartos que se usan o destinan exclusivamente para dormir.,Derecho a la vivienda,Reducción de las desigualdades,Censo de Población y Vivienda,Censo de Población y Vivienda,https://www.inegi.org.mx/programas/ccpv/2020/
Viviendas en Gustavo A. Madero por número de dormitorios,Total de viviendas según el número de cuartos que se usan o destinan exclusivamente para dormir.,Derecho a la vivienda,Reducción de las desigualdades,Censo de Población y Vivienda,Censo de Población y Vivienda,https://www.inegi.org.mx/programas/ccpv/2020/
Viviendas en Magdalena Contreras por número de dormitorios,Total de viviendas según el número de cuartos que se usan o destinan exclusivamente para dormir.,Derecho a la vivienda,Reducción de las desigualdades,Censo de Población y Vivienda,Censo de Población y Vivienda,https://www.inegi.org.mx/programas/ccpv/2020/
Viviendas en Álvaro Obregón por número de dormitorios,Total de viviendas según el número de cuartos que se usan o destinan exclusivamente para dormir.,Derecho a la vivienda,Reducción de las desigualdades,Censo de Población y Vivienda,Censo de Población y Vivienda,https://www.inegi.org.mx/programas/ccpv/2020/
