titulo,descripcion,instrumento,derecho,ods,fuente,fuente_url
Disponibilidad media anual de agua subterránea (DMA),"Volumen medio anual de agua subterránea que, cuando es positivo, puede ser extraído de un acuífero para diversos usos, adicional a la extracción ya concesionada y a la descarga natural comprometida, sin poner en peligro el equilibrio de los ecosistemas.",PGOT,Derecho a un medio ambiente sano,Agua limpia y saneamiento,"CONAGUA, a través del Diario Oficial de la Federación",https://www.dof.gob.mx/nota_detalle.php?codigo=5708074&fecha=09/11/2023#gsc.tab=0
Agua no contabilizada A (agua producida no facturada),"Determina el proporción del volumen de agua que se pierde debido a la existencia de fugas en la red, errores de medición, tomas no registradas en el padron de usuarios y clandestinaje, respecto al agua potable producida",PGOT,Derecho al agua y a su saneamiento,Agua limpia y saneamiento,PGIRH,No disponible
Porcentaje de viviendas propias,"Este indicador muestra el porcentaje de las viviendas de la Ciudad de México que son propias o que son propias y se están pagando, respecto del total de las viviendas de la Ciudad.",Visor CDMX,Derecho a la vivienda,Reducción de las desigualdades,"INEGI, Encuesta Nacional de Ingresos y Gastos de los Hogares (ENIGH)",https://www.inegi.org.mx/programas/enigh/nc/2022/
Acciones (financiamientos) otorgados a personas con ingresos iguales o menores a 6 UMAs mensuales,"Este indicador busca conocer el número de acciones (financiamientos) para vivienda otorgados anualmente a personas con ingresos menores a 6 UMAs mensuales en la capital del país, independientemente del organismo o intermediario financiero y la modalidad y destino de dicho crédito o financiamiento.",PGOT,Derechos laborales,Trabajo decente y crecimiento económico,"SEDATU, Sistema Nacional de Información e Indicadores de Vivienda, SNIIV",https://sniiv.sedatu.gob.mx/Reporte/Datos_abiertos
Acceso integral al agua y al saneamiento básico,Porcentaje de la población de la CDMX con: 1) servicio de agua potable entubada en su vivienda o terreno y con dotación diaria; 2) conexión a la red de drenaje o fosa séptica; y 3) excusado exclusivo en la vivienda.,PGOT,Derecho al agua y a su saneamiento,Agua limpia y saneamiento,"INEGI, Encuesta Nacional de Ingresos y Gastos de los Hogares (ENIGH)",https://www.inegi.org.mx/programas/enigh/nc/2020/#Microdatos
Agua renovable anual per cápita,Se denomina agua renovable a la cantidad máxima de agua que es factible explotar anualmente en un país sin alterar el ecosistema y que se renueva por medio de la lluvia.,PGOT,Derecho al agua y a su saneamiento,Agua limpia y saneamiento,"CONAGUA, SINA",https://sinav30.conagua.gob.mx:8080/SINA/?opcion=aguasr
Días limpios al año,Días del año que cumplen con la Norma Oficial Mexicana en Salud Correspondiente.,PGD,Derecho a un medio ambiente sano,Ciudades y comunidades sostenibles,"SEDEMA, SIMAT",http://www.aire.cdmx.gob.mx/default.php
Eficiencia en las Plantas de Tratamiento de Aguas Residuales (PTARs),Este indicador busca estimar la eficiencia de tratamiento de las PTAR de la Ciudad de México en función de su capacidad instalada y el caudal efectivamente tratado.,PGOT,Derecho al agua y a su saneamiento,Agua limpia y saneamiento,CONAGUA,https://www.gob.mx/conagua/documentos/inventario-de-plantas-municipales-de-potabilizacion-y-de-tratamiento-de-aguas-residuales-en-operacion
"Especies endémicas, amenazadas o en peligro de extinción inventariadas","Porcentaje de especies animales endémicas, amenazadas o en peligro de extinción inventariadas señaladas por el catálogo de especies animales y vegetales bajo el cuidado en los zoológicos de la ciudad respecto de las que se encuentran en el inventario de activo biológico de esepcies bajo el cuidado en los zoológicos de la ciudad.",PGOT,Protección a los animales,Vida de ecosistemas terrestres,Secretaría del Medio Ambiente (SEDEMA),https://www.gob.mx/profepa/documentos/norma-oficial-mexicana-nom-059-semarnat-2010
Vehículos de Motor Registrados en Circulación en Iztacalco,Número de vehículos motorizados particulares registrados que se encuentran en circulación en la Ciudad de México por alcaldía.,Visor Alcaldías,Derecho a la movilidad,Ciudades y comunidades sostenibles,https://www.inegi.org.mx/programas/vehiculosmotor/,https://www.inegi.org.mx/programas/vehiculosmotor/
Vehículos de Motor Registrados en Circulación en Miguel Hidalgo,Número de vehículos motorizados particulares registrados que se encuentran en circulación en la Ciudad de México por alcaldía.,Visor Alcaldías,Derecho a la movilidad,Ciudades y comunidades sostenibles,https://www.inegi.org.mx/programas/vehiculosmotor/,https://www.inegi.org.mx/programas/vehiculosmotor/
Vehículos de Motor Registrados en Circulación en Milpa Alta,Número de vehículos motorizados particulares registrados que se encuentran en circulación en la Ciudad de México por alcaldía.,Visor Alcaldías,Derecho a la movilidad,Ciudades y comunidades sostenibles,INEGI,https://www.inegi.org.mx/programas/vehiculosmotor/
Vehículos de Motor Registrados en Circulación en Tláhuac,Número de vehículos motorizados particulares registrados que se encuentran en circulación en la Ciudad de México por alcaldía.,Visor Alcaldías,Derecho a la movilidad,Ciudades y comunidades sostenibles,https://www.inegi.org.mx/programas/vehiculosmotor/,https://www.inegi.org.mx/programas/vehiculosmotor/
Vehículos de Motor Registrados en Circulación en Venustiano Carranza,Número de vehículos motorizados particulares registrados que se encuentran en circulación en la Ciudad de México por alcaldía.,Visor Alcaldías,Derecho a la movilidad,Ciudades y comunidades sostenibles,https://www.inegi.org.mx/programas/vehiculosmotor/,https://www.inegi.org.mx/programas/vehiculosmotor/
Vehículos de Motor Registrados en Circulación en La Magdalena Contreras,Número de vehículos motorizados particulares registrados que se encuentran en circulación en la Ciudad de México por alcaldía.,Visor Alcaldías,Derecho a la movilidad,Ciudades y comunidades sostenibles,INEGI,https://www.inegi.org.mx/programas/vehiculosmotor/
Vehículos de Motor Registrados en Circulación en Álvaro Obregón,Número de vehículos motorizados particulares registrados que se encuentran en circulación en la Ciudad de México por alcaldía.,Visor Alcaldías,Derecho a la movilidad,Ciudades y comunidades sostenibles,INEGI,https://www.inegi.org.mx/programas/vehiculosmotor/
Vehículos de Motor Registrados en Circulación en Benito Juárez,Número de vehículos motorizados particulares registrados que se encuentran en circulación en la Ciudad de México por alcaldía.,Visor Alcaldías,Derecho a la movilidad,Ciudades y comunidades sostenibles,INEGI,https://www.inegi.org.mx/programas/vehiculosmotor/
Vehículos de Motor Registrados en Circulación en Gustavo A. Madero,Número de vehículos motorizados particulares registrados que se encuentran en circulación en la Ciudad de México por alcaldía.,Visor Alcaldías,Derecho a la movilidad,Ciudades y comunidades sostenibles,INEGI,https://www.inegi.org.mx/programas/vehiculosmotor/
Vehículos de Motor Registrados en Circulación en Cuajimalpa de Morelos,Número de vehículos motorizados particulares registrados que se encuentran en circulación en la Ciudad de México por alcaldía.,Visor Alcaldías,Derecho a la movilidad,Ciudades y comunidades sostenibles,INEGI,https://www.inegi.org.mx/programas/vehiculosmotor/
Vehículos de Motor Registrados en Circulación en Iztapalapa,Número de vehículos motorizados particulares registrados que se encuentran en circulación en la Ciudad de México por alcaldía.,Visor Alcaldías,Derecho a la movilidad,Ciudades y comunidades sostenibles,INEGI,https://www.inegi.org.mx/programas/vehiculosmotor/
Vehículos de Motor Registrados en Circulación en Tlalpan,Número de vehículos motorizados particulares registrados que se encuentran en circulación en la Ciudad de México por alcaldía.,Visor Alcaldías,Derecho a la movilidad,Ciudades y comunidades sostenibles,INEGI,https://www.inegi.org.mx/programas/vehiculosmotor/
Vehículos de Motor Registrados en Circulación en Cuauhtémoc,Número de vehículos motorizados particulares registrados que se encuentran en circulación en la Ciudad de México por alcaldía.,Visor Alcaldías,Derecho a la movilidad,Ciudades y comunidades sostenibles,INEGI,https://www.inegi.org.mx/programas/vehiculosmotor/
Vehículos de Motor Registrados en Circulación en Coyoacán,Número de vehículos motorizados particulares registrados que se encuentran en circulación en la Ciudad de México por alcaldía.,Visor Alcaldías,Derecho a la movilidad,Ciudades y comunidades sostenibles,INEGI,https://www.inegi.org.mx/programas/vehiculosmotor/
Vehículos de Motor Registrados en Circulación en Xochimilco,Número de vehículos motorizados particulares registrados que se encuentran en circulación en la Ciudad de México por alcaldía.,Visor Alcaldías,Derecho a la movilidad,Ciudades y comunidades sostenibles,INEGI,https://www.inegi.org.mx/programas/vehiculosmotor/
Vehículos de Motor Registrados en Circulación en Azcapotzalco,Número de vehículos motorizados particulares registrados que se encuentran en circulación en la Ciudad de México por alcaldía.,Visor Alcaldías,Derecho a la movilidad,Ciudades y comunidades sostenibles,INEGI,https://www.inegi.org.mx/programas/vehiculosmotor/
Senderos seguros,"Total de senderos Camina Libre, Camina Segura.",PGOT,Derecho a la vía pública,Ciudades y comunidades sostenibles,SOBSE,https://www.obras.cdmx.gob.mx/secretaria/informes-de-gobierno
Superficie forestal restaurada,Total de la superficie reforestada dentro y fuera de las Reglas de Operación establecidas para la asignación de apoyos económicos a actividades de reforestación.,PGD,Derecho a un medio ambiente sano,Vida de ecosistemas terrestres,"CONAFOR, Gerencia de Reforestación",http://dgeiawf.semarnat.gob.mx:8080/ibi_apps/WFServlet?IBIF_ex=D3_RFORESTA09_06&IBIC_user=dgeia_mce&IBIC_pass=dgeia_mce&NOMBREENTIDAD=*&NOMBREANIO=* 
Disminución del volumen extraído en pozos con agua de mala calidad,"Determina el volumen de agua acumulado que se logra dejar de extraer del acuifero en pozos de mala calidad, al ser sustituido con agua de fuentes más sustentables y de mayor calidad.",PGOT,Derecho al agua y a su saneamiento,Agua limpia y saneamiento,"SACMEX, Programa de Gestión Integral de los Recursos Hídricos (PGIRH)",No disponible
Índice SST de análisis de calidad del agua,Promedio de las distintas mediciones del índice SST (Suspensión de Sólidos Totales) hechas para el análisis de calidad del agua.,PGOT,Derecho al agua y a su saneamiento,Agua limpia y saneamiento,"CONAGUA, SINA, Calidad del agua",https://www.gob.mx/conagua/articulos/calidad-del-agua
Índice DBO de análisis de calidad del agua,Promedio de las mediciones del índice anual DBO (Demanda Bioquímica de Oxígeno) hechas para el análisis de calidad del agua.,PGOT,Derecho al agua y a su saneamiento,Agua limpia y saneamiento,"CONAGUA, Calidad del agua",https://www.gob.mx/conagua/articulos/calidad-del-agua
"Rendimiento agrícola total de lechuga, romeritos, col, maíz y verdolaga en las alcaldías Xochimilco y Tláhuac","Valor de la producción agrícola cosechada de lechuga, romeritos, col, maíz y  verdolaga en Xochimilco y Tlahuac para ciclo cíclico-perenne de modalidad riego-temporal por hectárea.",PGOT,"Derecho a la tierra, al territorio y a los recursos naturales",Producción y consumo responsables,SIAP (s.f.) Anuario estadístico de la producción agrícola,https://nube.siap.gob.mx/cierreagricola/
Rendimiento total del área agrícola,Valor de la producción agrícola cosechada para ciclo cíclico-perenne de modalidad riego-temporal por hectárea.,PGOT,"Derecho a la tierra, al territorio y a los recursos naturales",Producción y consumo responsables,Servicio de Información Agroalimentaria y Pesquera (SIAP),https://nube.siap.gob.mx/cierreagricola/
Viviendas que cuentan con calentador solar,Porcentaje de viviendas que cuentan con calentador solar respecto del total de viviendas particulares habitadas.,PGOT,Derecho al desarrollo sustentable,Energía asequible y no contaminante,"INEGI, ENIGH",https://www.inegi.org.mx/programas/enigh/nc/2022/
Denuncias totales en Venustiano Carranza,Número de comunicaciones formales por las cuales el delito declarado por el informante es denunciado ante el Ministerio Público con la finalidad de iniciar una carpeta de investigación.,Visor Alcaldías,Derecho de acceso a la justicia,"Paz, justicia e instituciones sólidas",Secretariado Ejecutivo del Sistema Nacional de Seguridad Pública,https://www.gob.mx/sesnsp/acciones-y-programas/datos-abiertos-de-incidencia-delictiva?state=published
Denuncias totales en Miguel Hidalgo,Número de comunicaciones formales por las cuales el delito declarado por el informante es denunciado ante el Ministerio Público con la finalidad de iniciar una carpeta de investigación.,Visor Alcaldías,Derecho de acceso a la justicia,"Paz, justicia e instituciones sólidas",Secretariado Ejecutivo del Sistema Nacional de Seguridad Pública,https://www.gob.mx/sesnsp/acciones-y-programas/datos-abiertos-de-incidencia-delictiva?state=published
Denuncias totales en Cuauhtémoc,Número de comunicaciones formales por las cuales el delito declarado por el informante es denunciado ante el Ministerio Público con la finalidad de iniciar una carpeta de investigación.,Visor Alcaldías,Derecho de acceso a la justicia,"Paz, justicia e instituciones sólidas",Secretariado Ejecutivo del Sistema Nacional de Seguridad Pública,https://www.gob.mx/sesnsp/acciones-y-programas/datos-abiertos-de-incidencia-delictiva?state=published
Denuncias totales de Benito Juárez,Número de comunicaciones formales por las cuales el delito declarado por el informante es denunciado ante el Ministerio Público con la finalidad de iniciar una carpeta de investigación.,Visor Alcaldías,Derecho de acceso a la justicia,"Paz, justicia e instituciones sólidas",Secretariado Ejecutivo del Sistema Nacional de Seguridad Pública,https://www.gob.mx/sesnsp/acciones-y-programas/datos-abiertos-de-incidencia-delictiva?state=published
Denuncias totales en Xochimilco,Número de comunicaciones formales por las cuales el delito declarado por el informante es denunciado ante el Ministerio Público con la finalidad de iniciar una carpeta de investigación.,Visor Alcaldías,Derecho de acceso a la justicia,"Paz, justicia e instituciones sólidas",Secretariado Ejecutivo del Sistema Nacional de Seguridad Pública,https://www.gob.mx/sesnsp/acciones-y-programas/datos-abiertos-de-incidencia-delictiva?state=published
Denuncias totales en Tlalpan,Número de comunicaciones formales por las cuales el delito declarado por el informante es denunciado ante el Ministerio Público con la finalidad de iniciar una carpeta de investigación.,Visor Alcaldías,Derecho de acceso a la justicia,"Paz, justicia e instituciones sólidas",Secretariado Ejecutivo del Sistema Nacional de Seguridad Pública,https://www.gob.mx/sesnsp/acciones-y-programas/datos-abiertos-de-incidencia-delictiva?state=published
Denuncias totales en Tláhuac,Número de comunicaciones formales por las cuales el delito declarado por el informante es denunciado ante el Ministerio Público con la finalidad de iniciar una carpeta de investigación.,Visor Alcaldías,Derecho de acceso a la justicia,"Paz, justicia e instituciones sólidas",Secretariado Ejecutivo del Sistema Nacional de Seguridad Pública,https://www.gob.mx/sesnsp/acciones-y-programas/datos-abiertos-de-incidencia-delictiva?state=published
Denuncias totales en Álvaro Obregón,"Número de comunicaciones formales por las cuales el delito declarado por el informante es denunciado ante el Ministerio Público con la finalidad de iniciar una carpeta de investigación.  

En Álvaro Obregón se registraron mil 218 denuncias hasta junio del 2024.",Visor Alcaldías,Derecho de acceso a la justicia,"Paz, justicia e instituciones sólidas",Secretariado Ejecutivo del Sistema Nacional de Seguridad Pública,https://www.gob.mx/sesnsp/acciones-y-programas/datos-abiertos-de-incidencia-delictiva?state=published
Denuncias totales en Milpa Alta,Número de comunicaciones formales por las cuales el delito declarado por el informante es denunciado ante el Ministerio Público con la finalidad de iniciar una carpeta de investigación.,Visor Alcaldías,Derecho de acceso a la justicia,"Paz, justicia e instituciones sólidas",Secretariado Ejecutivo del Sistema Nacional de Seguridad Pública,https://www.gob.mx/sesnsp/acciones-y-programas/datos-abiertos-de-incidencia-delictiva?state=published
Denuncias totales en Magdalena Contreras,Número de comunicaciones formales por las cuales el delito declarado por el informante es denunciado ante el Ministerio Público con la finalidad de iniciar una carpeta de investigación.,Visor Alcaldías,Derecho de acceso a la justicia,"Paz, justicia e instituciones sólidas",Secretariado Ejecutivo del Sistema Nacional de Seguridad Pública,https://www.gob.mx/sesnsp/acciones-y-programas/datos-abiertos-de-incidencia-delictiva?state=published
Denuncias totales en Iztapalapa,Número de comunicaciones formales por las cuales el delito declarado por el informante es denunciado ante el Ministerio Público con la finalidad de iniciar una carpeta de investigación.,Visor Alcaldías,Derecho de acceso a la justicia,"Paz, justicia e instituciones sólidas",Secretariado Ejecutivo del Sistema Nacional de Seguridad Pública,https://www.gob.mx/sesnsp/acciones-y-programas/datos-abiertos-de-incidencia-delictiva?state=published
Denuncias totales en Iztacalco,Número de comunicaciones formales por las cuales el delito declarado por el informante es denunciado ante el Ministerio Público con la finalidad de iniciar una carpeta de investigación.,Visor Alcaldías,Derecho de acceso a la justicia,"Paz, justicia e instituciones sólidas",Secretariado Ejecutivo del Sistema Nacional de Seguridad Pública,https://www.gob.mx/sesnsp/acciones-y-programas/datos-abiertos-de-incidencia-delictiva?state=published
Denuncias totales en Gustavo A. Madero,Número de comunicaciones formales por las cuales el delito declarado por el informante es denunciado ante el Ministerio Público con la finalidad de iniciar una carpeta de investigación.,Visor Alcaldías,Derecho de acceso a la justicia,"Paz, justicia e instituciones sólidas",Secretariado Ejecutivo del Sistema Nacional de Seguridad Pública,https://www.gob.mx/sesnsp/acciones-y-programas/datos-abiertos-de-incidencia-delictiva?state=published
Denuncias totales en Cuajimalpa,Número de comunicaciones formales por las cuales el delito declarado por el informante es denunciado ante el Ministerio Público con la finalidad de iniciar una carpeta de investigación.,Visor Alcaldías,Derecho de acceso a la justicia,"Paz, justicia e instituciones sólidas",Secretariado Ejecutivo del Sistema Nacional de Seguridad Pública,https://www.gob.mx/sesnsp/acciones-y-programas/datos-abiertos-de-incidencia-delictiva?state=published
Denuncias totales en Coyoacán,Número de comunicaciones formales por las cuales un delito declarado por el informante es denunciado ante el Ministerio Público con la finalidad de iniciar una carpeta de investigación.,Visor Alcaldías,Derecho de acceso a la justicia,"Paz, justicia e instituciones sólidas",Secretariado Ejecutivo del Sistema Nacional de Seguridad Pública,https://www.gob.mx/sesnsp/acciones-y-programas/datos-abiertos-de-incidencia-delictiva?state=published
Denuncias totales en Azcapotzalco,Número de comunicaciones formales por las cuales el delito declarado por el informante es denunciado ante el Ministerio Público con la finalidad de iniciar una carpeta de investigación.,Visor Alcaldias,Derecho de acceso a la justicia,"Paz, justicia e instituciones sólidasDerechos Humanos, Seguridad y Justicia",Secretariado Ejecutivo del Sistema Nacional de Seguridad Pública,https://www.gob.mx/sesnsp/acciones-y-programas/datos-abiertos-de-incidencia-delictiva?state=published
Porcentaje de colonias donde las viviendas tienen acceso a espacio público a menos de 10 minutos,"Porcentaje de colonias con acceso a espacio público a 10 minutos o menos, según norma de la OMS. Los elementos utilizados para definir espacio público son: Jardín vecinal, Bosque o parque regional, Parque de barrio y Parque urbano.",PGD,Derecho al espacio público,Ciudades y comunidades sostenibles,Inventario de Áreas Verdes,https://www.inegi.org.mx/programas/ccpv/2020/#Microdatos
Asentamientos humanos en suelo de conservación,Superficie total del suelo de conservación que cubren los asentamientos humanos irregulares.,PGD,"Derecho a la tierra, al territorio y a los recursos naturales",Ciudades y comunidades sostenibles,IPDP,https://ipdp.cdmx.gob.mx/storage/app/uploads/public/63a/482/80e/63a48280e36f7893549739.pdf
Porcentaje de Programas de Ordenamiento Territorial actualizados,Porcentaje de Programas de Ordenamiento Territorial que han sido actualizados.,PGD,"Derecho a la tierra, al territorio y a los recursos naturales",Ciudades y comunidades sostenibles,SEDUVI,http://www.data.seduvi.cdmx.gob.mx/portal/index.php/programas-de-desarrollo
Porcentaje de denuncias de delitos sin inicio de carpeta de investigación que fueron atendidas con actitud hostil y/o desinterés,Porcentaje de denuncias de delitos que fueron atendidas con actitud hostil y/o desinterés respecto de todas las denuncias sin inicio de carpeta de investigación.,PGD,Derecho de acceso a la justicia,"Paz, justicia e instituciones sólidas","INEGI, Encuesta Nacional de Victimización y Percepción sobre Seguridad Pública (ENVIPE)",https://www.inegi.org.mx/programas/envipe/2023/
Porcentaje de delitos con inicio de carpeta de investigación que fue resuelta por reparación del daño o porque se otorgó el perdón,Porcentaje de delitos con inicio de carpeta de investigación que fue resuelta por reparación del daño o porque se otorgó el perdón.,PGD,Derecho a la reparación integral,"Paz, justicia e instituciones sólidas","INEGI, Encuesta Nacional de Victimización y Percepción sobre Seguridad Pública (ENVIPE)",https://www.inegi.org.mx/programas/envipe/2023/
Porcentaje de delitos con inicio de carpeta de investigación sin resolución,Porcentaje de delitos con inicio de carpeta de investigación donde no se resolvió nada.,PGD,Derecho de acceso a la justicia,"Paz, justicia e instituciones sólidas","INEGI, Encuesta Nacional de Victimización y Percepción sobre Seguridad Pública (ENVIPE)",https://www.inegi.org.mx/programas/envipe/2023/
Número de delitos de bajo impacto,Total de delitos de bajo impacto y otros delitos (delitos que no son de alto impacto).,PGD,Derecho a la seguridad ciudadana y a la prevención de la violencia y del delito,"Paz, justicia e instituciones sólidas","FGJ, Estadísticas delictivas",https://www.fgjcdmx.gob.mx/procuraduria/estadisticas-delictivas
Número de delitos de alto impacto,"Total de delitos de alto impacto (homicidio doloso, homicidio culposo, secuestro, extorsión, robo con violencia y violación).",PGD,Derecho a la seguridad ciudadana y a la prevención de la violencia y del delito,"Paz, justicia e instituciones sólidas","FGJ, Estadísticas delictivas",https://www.fgjcdmx.gob.mx/procuraduria/estadisticas-delictivas
Porcentaje de mujeres que han sufrido al menos un incidente de violencia en su relación actual o última,"Porcentaje de mujeres de 15 años y más que han sufrido al menos un incidente de violencia emocional, económica, física,  sexual o discriminación en su relación actual o última.",PGD,Derecho a una vida libre de todo tipo de violencia o discriminación,Igualdad de Género,"INEGI, Encuesta Nacional sobre la Dinámica de las Relaciones en los Hogares (ENDIREH)",https://www.inegi.org.mx/programas/endireh/2021/
Tasa del personal en seguridad pública,"Total de personas en seguridad pública por cada 100 mil habitantes. La tasa se calcula dividiendo la cantidad de personal de la policía entre la cantidad de habitantes, multiplicado por 100, 000. La información poblacional se obtuvo del Consejo Nacional de Población (CONAPO) para mitad del año. Indicadores demográficos 1950-2070.",PGD,Derecho a la seguridad ciudadana y a la prevención de la violencia y del delito,"Paz, justicia e instituciones sólidas","INEGI, CNSPE",https://www.inegi.org.mx/programas/cnspe/2021/
Porcentaje de programas sociales que se encuentran alineados con la Agenda 2030,Porcentaje de programas sociales cuyas reglas de operación reportan las metas de los Objetivos de Desarrollo Sostenible de la Agenda 2030 a las que están alineados.,PGD,Derecho a la Ciudad,Alianzas para lograr los objetivos,"EVALÚA, Inventario de Programas Sociales",https://www.evalua.cdmx.gob.mx/evaluacion/inventario
Porcentaje de ingresos por impuestos del gobierno de la Ciudad de México,Porcentaje de ingresos por impuestos del gobierno de la Ciudad de México con relación al total de ingresos.,PGD,Derecho a la buena administración pública,"Paz, justicia e instituciones sólidas","SAF, Cuenta Pública",https://servidoresx3.finanzas.cdmx.gob.mx/egresos/cp2023_24/
Promedio del IGOT de sujetos obligados de la CDMX,Promedio del IGOT (Índice Global de cumplimiento a las Obligaciones de Transparencia) del total de sujetos obligados de la CDMX.,PGD,Derecho a la información,"Paz, justicia e instituciones sólidas",Evaluación CDMX,https://infocdmx.org.mx/evaluacioncdmx/evaluaciones.php
